{
  "id": "media-abkc01",
  "kind": "chapter",
  "title": "Part 1",
  "source_id": "msrc-root05",
  "location": {
    "root_id": "msrc-root05",
    "path": "Iris Quill/Moon Rivets/01 Part 1.mp3"
  },
  "media_type": "audio/mpeg",
  "playable": "original",
  "band_ok": "child",
  "added_at": "2026-10-17T12:00:00Z",
  "subtitle": "Iris Quill",
  "description": null,
  "parent_id": "media-abk002",
  "duration_s": 1200,
  "size": null,
  "width": null,
  "height": null,
  "video_codec": null,
  "audio_codec": "mp3",
  "artwork": null,
  "previews": null,
  "chapters": [],
  "subtitles": [],
  "series": null,
  "season": null,
  "episode": null,
  "artist": null,
  "album": null,
  "album_artist": null,
  "track_no": 1,
  "disc_no": null,
  "year": null,
  "genre": null,
  "author": "Iris Quill",
  "narrator": null,
  "series_index": null,
  "locator_kind": "none",
  "external": null,
  "advisory": {
    "explicit": false,
    "source": "tag"
  },
  "verified_by_person_id": null,
  "fingerprint": "19200000-1791547200000",
  "hidden": false,
  "deleted_at": null,
  "trash_until": null,
  "created_at": "2026-10-17T12:00:00Z",
  "hlc": "1791547200000:0:hub001",
  "provenance": "hub:scan"
}
