{
  "id": "media-trk001",
  "kind": "track",
  "title": "Velvet Night",
  "source_id": "msrc-root03",
  "location": {
    "root_id": "msrc-root03",
    "path": "The Marlows/Tempo/03 Velvet Night.flac"
  },
  "media_type": "audio/flac",
  "playable": "original",
  "band_ok": "teen",
  "added_at": "2026-10-17T12:00:00Z",
  "subtitle": "The Marlows",
  "description": null,
  "parent_id": null,
  "duration_s": 214.6,
  "size": null,
  "width": null,
  "height": null,
  "video_codec": null,
  "audio_codec": "flac",
  "artwork": {
    "path": "The Marlows/Tempo/cover.jpg"
  },
  "previews": null,
  "chapters": [],
  "subtitles": [],
  "series": null,
  "season": null,
  "episode": null,
  "artist": "The Marlows",
  "album": "Tempo",
  "album_artist": "The Marlows",
  "track_no": 3,
  "disc_no": 1,
  "year": 2023,
  "genre": "Indie",
  "author": null,
  "narrator": null,
  "series_index": null,
  "locator_kind": "none",
  "external": null,
  "advisory": {
    "explicit": true,
    "source": "tag"
  },
  "verified_by_person_id": null,
  "fingerprint": "9100221-1791547200000",
  "hidden": false,
  "deleted_at": null,
  "trash_until": null,
  "created_at": "2026-10-17T12:00:00Z",
  "hlc": "1791547200000:0:hub001",
  "provenance": "hub:scan"
}
